{
  "schema_id": "orgsmith/graph-expected@1",
  "slug": "fernhollow-partners",
  "entities": [
    {
      "id": "x:fernhollow-partners",
      "canonical": "Fernhollow Partners LLC",
      "aliases": [],
      "kind": "org",
      "tags": []
    },
    {
      "id": "p:michael.white",
      "canonical": "Michael White",
      "aliases": [
        "michael.white@fernhollowpartners.com"
      ],
      "kind": "person",
      "tags": []
    },
    {
      "id": "p:sandra.perez",
      "canonical": "Sandra Perez",
      "aliases": [
        "sandra.perez@fernhollowpartners.com"
      ],
      "kind": "person",
      "tags": []
    },
    {
      "id": "p:briana.dennis",
      "canonical": "Briana Dennis",
      "aliases": [
        "briana.dennis@fernhollowpartners.com"
      ],
      "kind": "person",
      "tags": []
    },
    {
      "id": "p:ryan.strong",
      "canonical": "Ryan Strong",
      "aliases": [
        "ryan.strong@fernhollowpartners.com"
      ],
      "kind": "person",
      "tags": []
    },
    {
      "id": "p:daniel.powell",
      "canonical": "Daniel Powell",
      "aliases": [
        "daniel.powell@fernhollowpartners.com"
      ],
      "kind": "person",
      "tags": []
    },
    {
      "id": "x:nguyen-reynolds-and-martinez",
      "canonical": "Nguyen, Reynolds and Martinez",
      "aliases": [],
      "kind": "org",
      "tags": []
    },
    {
      "id": "x:perez-kemp",
      "canonical": "Perez-Kemp",
      "aliases": [],
      "kind": "org",
      "tags": []
    },
    {
      "id": "x:woods-llc",
      "canonical": "Woods LLC",
      "aliases": [],
      "kind": "org",
      "tags": []
    },
    {
      "id": "xp:amanda.golden",
      "canonical": "Amanda Golden",
      "aliases": [
        "amanda.golden@nguyenreynoldsandmartinez.com"
      ],
      "kind": "person",
      "tags": [
        "ambiguity:multi-affiliation"
      ]
    },
    {
      "id": "xp:jeffery.waller",
      "canonical": "Jeffery Waller",
      "aliases": [
        "jeffery.waller@perezkemp.com"
      ],
      "kind": "person",
      "tags": []
    },
    {
      "id": "xp:gerald.ross",
      "canonical": "Gerald Ross",
      "aliases": [
        "gerald.ross@woodsllc.com"
      ],
      "kind": "person",
      "tags": []
    },
    {
      "id": "xp:theresa.waller",
      "canonical": "Theresa Waller",
      "aliases": [
        "theresa.waller@nguyenreynoldsandmartinez.com"
      ],
      "kind": "person",
      "tags": []
    }
  ],
  "edges": [
    {
      "src": "p:michael.white",
      "dst": "x:fernhollow-partners",
      "kind": "works_at",
      "start": "2018-02-15",
      "end": null
    },
    {
      "src": "p:sandra.perez",
      "dst": "p:michael.white",
      "kind": "reports_to",
      "start": null,
      "end": null
    },
    {
      "src": "p:sandra.perez",
      "dst": "x:fernhollow-partners",
      "kind": "works_at",
      "start": "2018-03-15",
      "end": null
    },
    {
      "src": "p:briana.dennis",
      "dst": "p:sandra.perez",
      "kind": "reports_to",
      "start": null,
      "end": null
    },
    {
      "src": "p:briana.dennis",
      "dst": "x:fernhollow-partners",
      "kind": "works_at",
      "start": "2019-04-06",
      "end": null
    },
    {
      "src": "p:ryan.strong",
      "dst": "p:sandra.perez",
      "kind": "reports_to",
      "start": null,
      "end": null
    },
    {
      "src": "p:ryan.strong",
      "dst": "x:fernhollow-partners",
      "kind": "works_at",
      "start": "2019-02-17",
      "end": null
    },
    {
      "src": "p:daniel.powell",
      "dst": "p:michael.white",
      "kind": "reports_to",
      "start": null,
      "end": null
    },
    {
      "src": "p:daniel.powell",
      "dst": "x:fernhollow-partners",
      "kind": "works_at",
      "start": "2018-04-15",
      "end": null
    },
    {
      "src": "xp:amanda.golden",
      "dst": "x:woods-llc",
      "kind": "works_at",
      "start": null,
      "end": "2022-05-11"
    },
    {
      "src": "xp:amanda.golden",
      "dst": "x:nguyen-reynolds-and-martinez",
      "kind": "works_at",
      "start": "2022-05-12",
      "end": null
    },
    {
      "src": "xp:jeffery.waller",
      "dst": "x:perez-kemp",
      "kind": "works_at",
      "start": null,
      "end": null
    },
    {
      "src": "xp:gerald.ross",
      "dst": "x:woods-llc",
      "kind": "works_at",
      "start": null,
      "end": null
    },
    {
      "src": "xp:theresa.waller",
      "dst": "x:nguyen-reynolds-and-martinez",
      "kind": "works_at",
      "start": null,
      "end": null
    },
    {
      "src": "x:woods-llc",
      "dst": "x:fernhollow-partners",
      "kind": "client_of",
      "start": "2020-06-10",
      "end": null
    },
    {
      "src": "x:nguyen-reynolds-and-martinez",
      "dst": "x:fernhollow-partners",
      "kind": "client_of",
      "start": "2022-05-28",
      "end": null
    }
  ]
}
